Название Вакансии,URL,Название компании,Описание
Data Engineering Team Lead (Python / C++),https://vidnoe.hh.ru/vacancy/34106577?query=python, DataFork,"Автоматизация процессов сбора, хранения и анализа данных из открытых и закрытых источников (ETL / CMC). Автоматизация процессов обработки, «обогащения» и нормализации... Умение читать / писать код на python и С++. Опыт разработки в среде linux. Опыт руководства командой 3-5 человек. "
Machine learning engineer,https://vidnoe.hh.ru/vacancy/33947694?query=python, Tech5," Хорошее знание аналитической геометрии, линейной алгебры, математической статистики и численных методов. Знание С++/Python, достаточное для решения собственных research-задач. "
Python developer,https://vidnoe.hh.ru/vacancy/34005432?query=python, IVIDEON,Проектировать архитектуру новых сервисов. Автотестить написанное - сейчас код покрыт 800 функциональными тестами. Разрабатывать API приложений и интеграции. Опыт разработки микросервисов.
Python Web Developer,https://vidnoe.hh.ru/vacancy/33895741?query=python, Soshace,"If you answer “yes” to all questions, send us your CV and be ready to provide a portfolio of projects... Do you have more than 3-year commercial experience in web development on projects with Python? Do you have 1..."
Программист Python,https://vidnoe.hh.ru/vacancy/33833014?query=python," Смарт Текнолоджис,ООО","Разработка и поддержка приложений в сфере ИИ. Разработка диалоговых систем. Реализация бизнес-логики. Рефакторинг старого кода и проектирование нового.  ...работы python программистом более 3х лет. Отличное знание Python(>3.6), ООП, паттернов проектирования. Наличие реализованных проектов на Python. "
Python developer,https://vidnoe.hh.ru/vacancy/33811537?query=python, B2Broker Москва," Имеет опыт коммерческой разработки на Python 3 от 6 лет. Знает и умеет использовать: итераторы, генераторы, потоки. Отлично владеет знаниями..."
Python Data Scientist,https://vidnoe.hh.ru/vacancy/33840192?query=python, Web Interactive World,"Работа с большими объемами структурированных и неструктурированных данных. Подготовка данных, выявление закономерностей на признаках, feature engineering. Построение, оценка и внедрение... Хорошая математическая подготовка, владение основами статистики, умение объяснить и доказать полученный результат. Отличное владение Python и ML-стеком (statsmodels, sklearn..."
Разработчик Python,https://vidnoe.hh.ru/vacancy/34004511?query=python, Ingate,"Проектирование и реализация программных систем. Доработка, отладка и оптимизация существующих программ. Анализ и решение сложных технических проблем. Знание Python и опыт разработки на нем от 2 лет. Желательно знание базовых структур данных и операций над ними. "
Python разработчик,https://vidnoe.hh.ru/vacancy/34096488?query=python,ООО Диджитал медикэл оперейшнс,"Реализация сервисов на языке Python. Разработка бэкэнда для сервисов машинного обучения и интеллектуальных систем. Реализация алгоритмов для графов, онтологий, байесовских... Опыт работы в области создания программного обеспечения в качестве разработчика 1-3 года и выше. Понимание принципов ООП и шаблонов..."
Data analyst,https://vidnoe.hh.ru/vacancy/33659539?query=python,ООО РАБЛЗ,"Выделение сегментов пользователей по данным о них с использованием Python (pandas и др.), SQL и Pyspark. Разработка на Python универсальных... Опыт работы с инструментами распределенной обработки данных (Hadoop, Spark и др.). Опыт работы с машинным обучением на Python. "
Python Developer,https://vidnoe.hh.ru/vacancy/33599310?query=python, LLC ICONIC,"Разработка web сервисов на протоколе GraphQL. Разработка, проектирование и поддержка микросервисов. Интеграция с внешними и внутренними системами. Опыт разработки на Python не менее 2-х лет, разработки на >=Python 3.6.. Навык работы с SQLAlchemy. "
Junior Data scientist,https://vidnoe.hh.ru/vacancy/33860264?query=python, Платформа ОФД,"Решение исследовательских и прикладных задач в рамках создания и развития продуктов компании с применением современных методов статистического анализа и машинного... Опыт решения реальных бизнес-задач, используя методы машинного обучения и статистического анализа. Опыт применения Python для обработки и анализа данных..."
Методист-эксперт Python,https://vidnoe.hh.ru/vacancy/33842117?query=python, Алгоритмика,...оценки результатов учебной деятельности обучающихся отделения. Внесение предложений по совершенствованию образовательного процесса. Требования: Экспертиза в Python (преподавание + обучение преподавателей). 
Аналитик python,https://vidnoe.hh.ru/vacancy/33995292?query=python,Нек. орг. Государственное бюджетное учреждение города Москвы Центр налоговых доходов,"Повышение качества данных. Повышение эффективности существующих алгоритмов. Парсинг данных с открытых источников. Решение аналитических задачи по обработке большого массива данных. Знание SQL, PL/SQL (Oracle). Shapely, bs4, Dash, cx_Oracle. Основ машинного обучения. Linux (CLI). Python 3.x(pandas, numpy..."
Python разработчик,https://vidnoe.hh.ru/vacancy/33655550?query=python, Coin Liquidity Solutions,Разрабатывать и поддерживать торговых роботов. Создавать продукты для автоматизации процессов отдела продаж. Улучшать торговые стратегии путем сбора и анализа рыночных... Уверенное знание Python и любовь к чистому коду. Интерес к сфере криптовалют и трейдингу. Мотивацию к обучению и росту профессионального...
Разработчик Python / Django,https://vidnoe.hh.ru/vacancy/33917948?query=python, IT Gene,Поддержка и разработка порталов‚ обеспечивающих взаимодействие заказчика с распределенной сетью контрагентов (написаны на Django). Поддержка механизмов обмена данных между порталами... Опыт работы в аналогичной должности от двух лет. Опыт разработки на Python 2.7 и 3.5‚ Django 1.8...
Python разработчик (ЦКМ),https://vidnoe.hh.ru/vacancy/34069063?query=python, Сбербанк для экспертов,"В команду новостного мониторинга требуется опытный Python-разработчик для разработки архитектуры решения, построения процессов разработки, повышения стабильности сервиса.  опыт разработки на Python не менее 3-х лет. - опыт работы с PostgreSQL и ORM-библиотеками. - знакомство с Docker, Linux..."
Разработчик Python,https://vidnoe.hh.ru/vacancy/33974003?query=python, Йенго РУ,"Разработка Backend на Python. Профилирование кода, оптимизация производительности. Участие в проектировании архитектуры. Опыт работы веб-разработчиком в команде от 3-х лет. Уверенное владение Python 3, знание слабых и сильных сторон. "
Python разработчик (Senior),https://vidnoe.hh.ru/vacancy/33906030?query=python,ООО B2Basket.ru,"Доработка текущих проектов. Участие в разработке новых проектов. Python/ Django (опыт коммерческой разработки от 2 лет!). Git. MySQL, MongoDB. Понимае принципов работы RestAPI. Покрытие кода тестами. "
"Разработчик ПО (QT C++, Python)",https://vidnoe.hh.ru/vacancy/34114105?query=python,ООО ИТБ,"Сопровождение сервера (Python Twisted, SQL, Сопровождение клиента (QT4, C++) Написание новых функций, взаимодействие с другими клиентами. Опыт работы."
Python-разработчик,https://vidnoe.hh.ru/vacancy/33277482?query=python,ООО Фаззи Лоджик Лабс,Команда разработки банковских антифрод-решений ищет python-девелопера уровня от middle и выше для поддержки и разработки внутренних инструментов API... Опыт от 2 лет с Python в качестве основного языка разработки. Опыт в области Data Science/Machine Learning. 
Программист Python,https://vidnoe.hh.ru/vacancy/33887758?query=python," ЭВРИКА, Санкт-Петербург","Проектирование архитектуры программных средств, согласно заданной постановке задач. Разработка, сопровождение и первичное тестирование высоконагруженных прикладных программных средств. Участие в разработке... Опыт разработки на python3, желательно с использованием PyQT. Опыт разработки на C++ будет плюсом. Знание SQL, желательно опыт работы..."
Data Sсientist (ML/Python),https://vidnoe.hh.ru/vacancy/33481247?query=python,ООО Центр недвижимости от Сбербанка,"Разрабатывать и внедрять сервисы, использующие машинное обучение и deep learning. Участвовать в процессе подготовки данных. Разрабатывать различные модели машинного обучения.  Навыки программирования, умение писать хорошо читаемый код, знание Python. Знание и опыт работы с реляционными СУБД (мы используем Postgres). "
Machine Learning Engineer,https://vidnoe.hh.ru/vacancy/34081252?query=python, Nicotech International,Mine the data from internal and external sources. Help building and deploying robust and future proof Data Science models.  Strong object-oriented programming experience and proficiency in Python. Experience of working with popular Python data-related packages such as...
Junior Quantitative Researcher,https://vidnoe.hh.ru/vacancy/31844648?query=python,ООО КВАНТПОРТРУС,"Working with large and complex datasets to build quantitative models which predict future price movements. Applying modern mathematical and statistical... Strong knowledge of probability, statistics, optimization, numerical methods. Good programming skills in Python (numpy, sklearn, pandas, matplotlib, etc.). "
Программист Python,https://vidnoe.hh.ru/vacancy/33795095?query=python,ООО Твигл,"Использование Cython, Python C API, C/C++, Golang. Большим плюсом будет: Хорошее знание Linux систем. Опыт работы с данными в Python: numpy, pandas и прочее. Опыт работы с..."
Python/Django разработчик,https://vidnoe.hh.ru/vacancy/33890189?query=python, ecomsolutions,Docker containers deployment. Experience building REST APIs. Experience with a version control system.
Python Developer,https://vidnoe.hh.ru/vacancy/34069603?query=python, Лаборатория специальных вычислительных систем МФТИ,"Оптимизировать существующие программные модели, производить их рефакторинг. Интегрировать существующие C++ модели в среду Python. Разрабатывать графические инструменты для разработки РЛС.  ...Python не менее 3 лет. Знание методов цифровой обработки сигналов (DSP) и математики вообще. Хорошее знание научно-вычислительного стэка Python..."
Golang/Python developer,https://vidnoe.hh.ru/vacancy/33720457?query=python, Ostrovok.ru,"Поддержка и развитие высоконагруженного API. Технические задачи, связанные с мониторингом и аналитикой API-проекта. Разработка и поддержка интеграций с внешними... Опыт работы с Golang от 1 года (или уверенное знание Python с желанием развиваться на Golang). Опыт работы с СУБД. "
Data science,https://vidnoe.hh.ru/vacancy/33789276?query=python, Тесуджи,"Разработка предиктивных моделей для различных бизнес-задач компании (скоринг, поведенческие модели, антифрод, collection). Поддержка стабильности и валидация существующих моделей.  Опыт работы хотя бы с одним языком программирования: Python (библиотеки numpy, pandas, sklearn), R. Знание других языков приветствуется. "
Python Backend разработчик,https://vidnoe.hh.ru/vacancy/33653192?query=python,ООО Декаст Инжиниринг,"Работа с большими данными, анализ данных, разработка парсеров и интеграций. Поддержка высоконагруженных систем. Иметь представление об HTTP, CoAP, MQTT, TCP... Опыт производственной разработки в команде на Django с Python 3. Разработка на *unix + git."
Python developer,https://vidnoe.hh.ru/vacancy/33023986?query=python, Билайн,"Участие в планировании и проектировании задач. Разработка серверной части web-приложений на языке Python. Проведение code review. Написание UNIT и... Уверенное знание Python. Опыт работы с Django/DjangoRestFramework. Навыки программирования (ООП, паттерны, чистый код). Опыт командной работы с системой контроля..."
Junior Python разработчик,https://vidnoe.hh.ru/vacancy/33876623?query=python, amoCRM,"Задачи, с которыми придется столкнуться в первую очередь: написание тестов/автотестов, решение багов и простых задач. В последствии разработка нового... Потребуется: Знание Python (есть практический опыт и результаты, не обязательно коммерческие). Опыт написания SQL запросов (желательно умение работать со связями). "
Backend python/Django разработчик,https://vidnoe.hh.ru/vacancy/33787768?query=python,ООО БОЛЬШАЯ ТРОЙКА,Проектировать и разрабатывать серверные приложения (backend) сложных web-порталов в agile команде. Прямо сейчас в разработке информсистема масштабов региона с... 1-3 года промышленной разработки на Python. Отличное знание и владение: Python. Django. PostgreSQL. Опыт по созданию моделей в БД. 
Разработчик Python,https://vidnoe.hh.ru/vacancy/33828496?query=python, Открытые Технологии,Реализация нового функционала. Анализ чужого кода. Опыт промышленной разработки на Python. Опыт разработки многопоточных приложений. Опыт разработки многопроцессорных систем. Опыт работы с системами контроля версий. 
Тестировщик / QA,https://vidnoe.hh.ru/vacancy/33650546?query=python,"ЗАО СВЕМЕЛ, Многопрофильное внедренческое предприятие","Тестирование: прошивок для тонких клиентов, различных прикладных утилит, компонентов ОС (собственная разработка). Ведение тестовой документации. Взаимодействие с разработчиками. ...продвинутого пользователя (установка/настройка, сети, виртуализация (libvirt/kvm/qemu), bash). Знание Python, Ansible, git. Умение писать автотесты (Selenium, Java, Python)."
Python developer,https://vidnoe.hh.ru/vacancy/30005963?query=python, NetworkOptix,"Исследование проблем в работе тестируемого продукта с помощью различных инструментов. Библиотека для тестирования — Python-проект для работы с виртуальными машинами... Умение и опыт работы в команде. Уверенные знания Python. Опыт разработки под Linux, знание командной строки Linux. Наличие примеров кода. "
Senior Python Developer,https://vidnoe.hh.ru/vacancy/33635746?query=python,ООО Речевая аналитика,"Speech Analytics — первый и единственный в России сервис речевой аналитики для контакт-центров. Мы создали гибкую аналитическую платформу для мониторинга... Опыт разработки на Python от 3 лет. Прекрасные знания основных концепций веб-разработки (кэширование, сессии, очереди задач, работа со сторонними..."
Data scientist,https://vidnoe.hh.ru/vacancy/33842129?query=python, Свордфиш Секьюрити,"Извлечение данных из нескольких информационный систем. Анализ данных: выявление паттернов,кластеризация, выявление аномалий, статистика. Hadoop как плюс. Postrgre SQL MySQL. Java как плюс. Математическая статистика. Python обязательно. Знание BI Tableu. Опыт подготовки аналитических отчетов."
Разработчик Python,https://vidnoe.hh.ru/vacancy/33912680?query=python, Сбербанк для экспертов,"1. Разработка новых модулей системы. 2. Интеграция с другими системами банка. 3. Улучшение процессов CI/CD. 4. Покрытие функционала тестами.  2. Postgres, Kafka, ELK, prometheus (или другие системы для сбора логов и метрик). 3. Asyncio. Дополнительные преимущества."
PHP программист,https://vidnoe.hh.ru/vacancy/33948620?query=python,ООО РАДУГА-ИНТЕРНЕТ,"Сопровождение и развитие oss/bss и crm-системы, web-сайта . Навыки работы в Linux. Знание mysql. Желательно знание Python."
Разработчик Python Backend,https://vidnoe.hh.ru/vacancy/33690157?query=python, Web Interactive World,"Сбор данных, разработка архитектуры их хранения, представление их удобном для анализа виде. Построение архитектуры решения, написание ключевых блоков кода проекта.  Отличное знание Python 3.6 (ООП). Опыт работы с веб-фреймворками Django, Celery. Владение многопоточным multiprocessing и асинхронными подходами asyncio..."
Разработчик Python,https://vidnoe.hh.ru/vacancy/33875623?query=python,ООО Кузница Кадров,"Проектирование и реализация законченных функциональных модулей системы. Ввод системы в промышленную эксплуатацию. Работа на стеке: Oracle/Hadoop/Teradata, Python/Spark... ...Python или Java от 1 года. Уверенные знания SQL. Знание реляционных баз данных (RDB). Желание развиваться в разработке на Python."
Программист Python,https://vidnoe.hh.ru/vacancy/33841740?query=python, Интерфакс,"Участвовать в реализации компонентов системы. - Разрабатывать предложения по рефакторингу, принимать участие в развитии внутренних стандартов и практик. - Участвовать в code... Хорошее знание языка программирования Python (версии 2 и 3). - Опыт разработки с использованием фреймворков Django, Flask. - Опыт использования SQLAlchemy, написание..."
Python разработчик / Python software developer,https://vidnoe.hh.ru/vacancy/33416348?query=python, Cindicator,Про процесс интервью: Два подряд идущих интервью на способность решения брейнтизеров: загадки из разных областей программирования и логики.  Богатый опыт в коммерческой разработке ПО на Python. Он может быть связан с любой из этих областей (или сразу со...
