Название Вакансии,URL,Название компании,Описание
Senior C# Developer,https://vidnoe.hh.ru/vacancy/33824572?query=python, DM Basis,"Code review (C#), разработка API, простейших фронтендов на ASP.NET Core, разработка ETL с использованием SSIS, разработка Database-layer кода на... C# 6 (уверенное знание), SQL, MS SQL, Docker, .NET Core, ASP.NET Core, PostgreSQL, SQL Server Integration Services, знание Python Airflow..."
Аналитик (Digital marketing),https://vidnoe.hh.ru/vacancy/33287597?query=python, OZON.ru Маркетинг,"Цифровое аналитическое сопровождение маркетинга и digital маркетинг блока, совместная работа с маркетологами, продукт менеджерами и коллегами из разных бизнес-вертикалей.  Знание SQL (обязательно) + Python (будет плюсом) и желание развиваться в области анализа данных(веб+back). Понимание работы рекламных систем, принципов..."
Инженер отдела клиентской поддержки TIER2,https://vidnoe.hh.ru/vacancy/33653504?query=python, Detego,"Техническая поддержка клиентов 2 уровня в отношении всей линейки продуктов компании Detego. Обработка и анализ инцидентов и их первопричин для... Также будет преимуществом: знание языков программирования (C#, Powershell, Python, JavaScript). Прагматичное и ориентированное на решение проблем мышление. Внимательное отношение к..."
Ведущий инженер направления мобильной связи,https://vidnoe.hh.ru/vacancy/33416532?query=python,ОАО Межрегиональный ТранзитТелеком,"Администрирование сетевых элементов CS Core (SMSC, SMSFW, CGW, HLR, GMSC, MGW, SRF). Устранение неисправностей оборудования. Мониторинг и анализ состояния оборудования... Знание языка SQL. Опыт работы с реляционными СУБД (желательно Oracle). Навыки программирования (приветствуется опыт написания скриптов shell, python)."
Инженер DevOps,https://vidnoe.hh.ru/vacancy/29323686?query=python, Новые Облачные Технологии,"Писать: Скрипты автоматизации на bash/python. Dockerfile'ы разрабатываемых систем. Небольшие вспомогательные сервисы на python/go. Роли и сценарии на... Ansible. Jenkins + Pipeline. Git/gitlab. Навыки автоматизации работы: Bash/python. Postfix. DNS, и, в частности, SPF/DKIM. "
Эксперт по кибербезопасности,https://vidnoe.hh.ru/vacancy/33367220?query=python,ООО Центр недвижимости от Сбербанка,"Понимающее IT-руководство. Например, у нас есть квота 1 день в неделю на борьбу с тех. долгом/саморазвитие/рисеч/решение... Высшее образование по направлению «информационная безопасность». Глубокое знание законодательства в области информационной безопасности (382-п, требования ФСБ по криптографии, стандарты..."
BI разработчик,https://vidnoe.hh.ru/vacancy/34092586?query=python, Вайлдберриз,"Проектирование и реализация комплексного решения для аналитики. Наполнение хранилища данными из различных источников. Изучение всевозможных сторонних решений, применимых для реализации... Хорошее знание СУБД PostgreSQL (разработка/администирование). Опыт использования Clickhouse, Vertica. Знание Python. Опыт использования docker, kubernetes. Использование Ansible. "
Программист-разработчик,https://vidnoe.hh.ru/vacancy/33989232?query=python, DIS Group,"Интеграции, синхронизации, миграции данных, построению и загрузке хранилищ данных. Обеспечения качества данных. Построения единых клиентских/продуктовых справочников. Управления тестовыми средами... Английский язык на уровне чтения технической литературы. Понимание принципов построения хранилищ данных. Навыки оптимизации производительности приложения. Знание Java или Python."
Старший разработчик Python (Api4Biz),https://vidnoe.hh.ru/vacancy/33657065?query=python, Авито,Писать новые и поддерживать уже существующие сервисы на Python (3.6) с использованием AsyncIO и/или Tornado. Участвовать во всех... Знаете Python 3.6 (AsyncIO). Работали с Kubernetes. Имеете опыт работы с актуальными версиями PHP или готовы его освоить. 
Ведущий биоинформатик,https://vidnoe.hh.ru/vacancy/33890155?query=python," Insilico Medicine, Inc","Разработка и реализация алгоритмов работы с массовыми типами молекулярных данных различной природы (данные генной экспрессии, РНК-секвенирования, геномные, протеомные, метиломные... Необходимый опыт работы от 3 лет. Необходимые навыки: знание языков программирования (R, Python, Matlab и др.) для задач, связанных с..."
Инженер отдела эксплуатации,https://vidnoe.hh.ru/vacancy/33645521?query=python, Омникомм Технологии,"Обеспечение бесперебойной работы серверного ПО в круглосуточном режиме (ОС семейства Linux). Администрирование WEB-хостинга, поддержка web-приложений. Мониторинг работы сервисов.  Опыт написания скриптов на bash/python. Грамотная устная и письменная речь, логическое мышление, способность усваивать большие объёмы информации. "
QA Engineer (Full-stack),https://vidnoe.hh.ru/vacancy/34081680?query=python, Тинькофф,"Участвовать в создании качественных продуктов, которые помогают развиваться юридическим лицам. Работать по kanban. Анализировать и тестировать требования к разрабатываемым приложениям.  Плюсом будет: Знание и опыт написания автотестов на одном из языков программирования (java/js/python). Знание фреймворков тестирования: JUnit/TestNG..."
CI Engineer,https://vidnoe.hh.ru/vacancy/27812469?query=python, NetworkOptix,"CI система построена с использованием Jenkins job builder с элементами кода на bash, python и groovy. В задачи CI входит... Знание Python. Знание систем контроля версий git. Знание Linux. Будет плюсом: Знание Windows: администрирование, power shell, утилит. Знание C++. "
Principal Solution Architect for Imunify Security,https://vidnoe.hh.ru/vacancy/33843276?query=python, Cloud Linux,"Research new software technology concepts and tools to make informed recommendations. Resolve software architecture conflicts. Take ownership of application health... Advanced knowledge and experience in one or more of the following languages: Python, C, Golang, JavaScript, PHP. Excellent knowledge of..."
Аналитик / Специалист по обработке данных,https://vidnoe.hh.ru/vacancy/33753075?query=python, Kantar TNS,"Проверка, восстановление и преобразование данных по проведенным маркетинговым исследованиям. Выполнение статистических анализов ( с подбором методов под конкретную задачу) .  Умение работать в системах обработки данных на уровне написания скриптов/программ. Навыки программирования в Python/ VBA. Аналитический склад ума, желание..."
Data Scientist,https://vidnoe.hh.ru/vacancy/32318018?query=python, Samsung Research Center,"Поддержкой принятия бизнес решений компаний с помощью анализа данных и новейших методов машинного обучения. Разработкой системы по обработке и анализу... Обладает знаниями методов / метрик машинного обучения, понимание их сфер применимости, умение объяснить их коллегам. Имеет не менее 1 года практического..."
System Software Engineer- OS,https://vidnoe.hh.ru/vacancy/30600838?query=python, Samsung Research Center,"Development of kernel components and subsystems. Knowledge of ARM/AARCH64 architecture. - Debugging skills: HW and SW debuggers. - Development tools: Git, Bash, Perl/Python."
Инженер-тестировщик,https://vidnoe.hh.ru/vacancy/32060899?query=python,ООО Сервионика,"Анализ технического задания. Тестирование подсистем. Создание и поддержка в актуальном состоянии ПМИ. Предоставление данных для покрытия разрабатываемых модулей автотестами. Хорошая инженерная подготовка в сфере ИТ. Опыт разработки: PHP, ExtJS, JavaScript, Python/Django. Опыт использования Perl, bash и других скриптовых..."
Digital Analyst,https://vidnoe.hh.ru/vacancy/33976511?query=python,ООО Газпром-медиа Развлекательное телевидение (ГПМ РТВ),"Бизнес-аналитика: сбор метрик и данных по воронке продаж (DAU/MAU, MRR, LTV, LT, Churn, Retention и др.), работа с... Знание современных аналитических сервисов: Google Analytics, Yandex.Metrica, Facebook Analytics и Power BI. Знание Python в анализе данных (pandas, numpy +..."
Team Leader / Руководитель группы разработки,https://vidnoe.hh.ru/vacancy/32759320?query=python, Компания ПЭК,"Fullstack разработка внутреннего корпоративного социального портала. Разнообразные задачи: организация ленты активности, комментариев и прочего общения. Языки: JavaScript, Python,Фреймворки Django... Отличное знание Python, в работе используем Python. Отличное знание Diango, в работе используем Diango. Знание и умение использовать в работе..."
Преподаватель (тьютор),https://vidnoe.hh.ru/vacancy/33638879?query=python,ИП Щербаков Денис Викторович,Участие в промо-мероприятиях и конференциях. Интеллектуального общества. Транслирование программ КиберШколы по методическим пособиям и передача практического опыта для нового it-поколения от 6 до 14 лет. 
DevOps/Developer,https://vidnoe.hh.ru/vacancy/32880361?query=python,ООО Центр недвижимости от Сбербанка,"Разрабатывать систему, отвечающую за процессы CI/CD внутри компании. При разработке используются различные языки программирования (Python, Go, Java). Знание одного или нескольких языков программирования. Знание и понимание сетевых технологий (модель OSI,TCP/IP, UDP, HTTP). Уверенное владение Linux. "
Руководитель команды аналитиков (Дивизион 'Особенные решения'/Блок 'Розничный Бизнес'),https://vidnoe.hh.ru/vacancy/34095738?query=python, Сбербанк для экспертов,"Руководство командой аналитиков в роли «играющего тренера». Проведение аналитических исследований клиентской базы розничного бизнеса. Выявление устойчивых паттернов поведения клиентов.  п. Продвинутый уровень Excel, PowerPoint. Знание Python как плюс. Опыт руководства командой. Английский на уровне чтения англоязычной литературы по специальности. "
Специалист технической поддержки,https://vidnoe.hh.ru/vacancy/33886069?query=python,ООО ПИК-Аренда,"Мы ищем человека, который будет отвечать за работу по управлению запасами, для организации процесса складирования, контроля и настройки оборудования и... Аккуратность и ответственность. Проактивная работа в оптимизации процессов. Знание SQL и Python/PHP на уровне понимания процессов. Любовь к систематизации..."
Заместитель руководителя по управлению рисками,https://vidnoe.hh.ru/vacancy/33442896?query=python, ID Finance,Мониторинг эффективности действующих скоринговых моделей проекта. Анализ дополнительных источников данных - включение данных в скоринговые модели. Мониторинг и анализ качества розничного... Опыт работы со сложными SQL-запросами. Опыт работы Python (опыт разработки и валидации скоринговых моделей). Понимание бизнес-процессов розничного кредитования. 
Аналитик логистической платформы,https://vidnoe.hh.ru/vacancy/33631670?query=python, Joom,"Ad-hoc аналитика для поддержки принятия решений. А/В тестирование фичей, связанных с доставкой. Оценка эффективности новых каналов доставки, поиск... Знание математической статистики и опыт ее применения. Навыки программирования на Python (Pandas, Numpy). Умение писать SQL-запросы. Умение выбирать нужный..."
Системный администратор Linux,https://vidnoe.hh.ru/vacancy/33723529?query=python, Йенго РУ,"Администрирование собственных проектов компании. Настройка железа, ОС, сторонних и собственных сервисов. Поиск узких мест в производительности систем. Мониторинг всего работающего... Опыт администрирования РСУБД, хотя бы минимальный. Умение обращаться с sh/awk/sed/perl. Желательно опыт использования ansible. Желательно знания python."
Java-разработчик персональных рекомендаций в Музыку,https://vidnoe.hh.ru/vacancy/32165422?query=python, Яндекс, Уверенное знание Java. Базовые знания С++ и Python. Алгоритмическая подготовка. Базовые знания SQL. Интерес к машинному обучению и желание расти...
Старший Go разработчик (Verticals),https://vidnoe.hh.ru/vacancy/28952558?query=python, Авито,"Разрабатывать единый API для всех клиентских платформ. Участвовать в создании новых продуктов и функциональности. Работать над CI/CD, инструментами деплоя... Отлично владеете PHP/Python/Go и готовы развиваться в Go в будущем. Понимаете, как устроен HTTP. Уверенно пишете SQL и..."
Portfolio Risk manager,https://vidnoe.hh.ru/vacancy/33520403?query=python, Finstar Financial Group,"1. Credit portfolio and risk analysis, recommending corrective actions. Credit risk review, risk assessment reports. 2. Measure risks and develop... Score modelling experience would be a plus (R / Python/ SS / SPSS / etc.). - Excellent analytical and reporting skills. - Ability to deliver..."
IOS Developer,https://vidnoe.hh.ru/vacancy/32481016?query=python,ООО Центр недвижимости от Сбербанка,"Мы – продуктовая IT-компания по созданию highload проектов в сфере недвижимости. Мы отдельное от банка лицо, дочерняя компания, живем своей... Оптимизировать скорость работы приложения и его размер."
Frontend-разработчик (React),https://vidnoe.hh.ru/vacancy/33628292?query=python,ООО РАБЛЗ,"Разрабатывать красивый динамический Frontend для существующих продуктов кампании. Взаимодействовать с коллегами, обсуждать дизайн приложения, предлагать и внедрять технологические решения.  Опыт реализации отображения контента в виде stories. Опыт работы на Python/Java. Опыт работы с PostgreSQL, Oracle, MongoDB или другими..."
Тестировщик-автоматизатор api и web-интерфейса ERP-системы,https://vidnoe.hh.ru/vacancy/33989128?query=python, Институт макроэкономических исследований ВАВТ,"Поддержка/развитие решения автоматизированного тестирования системы CRM: Selenid, Selenoid. Автоматизация регрессионного тестирования проекта, подготовка бизнес-кейсов. Актуализация/расширение текущих кейсов.  Опыт создания тест-кейсов, тестовых сценариев. Владение одним из языков программирования: Java, Python, PHP. Опыт тестирования в коммерческих проектах не..."
C++ разработчик (интеграция),https://vidnoe.hh.ru/vacancy/34103286?query=python, Align Technology Inc,"Команда работает над задачами по интеграции CAD-системы с различными системами в производственном потоке: системами маршрутизации, сканером, приложениями для докторов... Опыт интеграции с RESTful APIs. Опыт работы с MFC, xml/json. Знание Python. Техническое образование (инженерное, computer science, математическое). "
DevOps Specialist,https://vidnoe.hh.ru/vacancy/34095765?query=python, KEDOO Entertainment,"Эксплуатация и развитие высоконагруженных проектов. Взаимодействие с командой разработки, DevOps-поддержка, выстраивание процессов CI/CD. Участие в проектировании новых сервисов... Linux. GitLab CI/CD. Nginx. Python. ClickHouse. Postgres. Redis. Kubernetes/Docker Swarm. Ansible. Опыт системного администрирования Linux от 2 лет. "
1С:Эксперт по технологическим вопросам платформы (рынок США),https://vidnoe.hh.ru/vacancy/32250998?query=python, 1С International,"Поддержание «здоровой» работы облачного внедрения, работающего на 1С:Фреш. Оптимизация: повышение масштабируемости, производительности и пропускной способности системы.  Желательно опыт программирования на одном или нескольких языках: C , C++, Java, Python, Perl, Bash. Желательно опыт работы с UNIX-системами..."
PHP-разработчик,https://vidnoe.hh.ru/vacancy/34093392?query=python, Vigrom Corp.,"Работа над новым функционалом, непрерывные улучшения и оптимизации текущего. Коммуникация с командами мобильной разработки и разработки игр. Поиски оптимальных вариантов... ...и принципов SOLID. Применение модульного тестирования. Опыт работы в долгосрочных проектах. Опыт работы с PostgreSQL. Знание дополнительных языков - JavaScript, Python."
Старший менеджер по аналитике финансовых сервисов,https://vidnoe.hh.ru/vacancy/34003139?query=python, Билайн,"Разработка отчетности, формирование витрин под отчетность. Выполнение ad-hoc запросов, построение мат моделей продуктов, создание презентаций. Формирование витрин для анализа... Опыт работы с банковскими продуктами и банковской аналитикой. Опыт формирования отчетов, выделение аналитик. Знание PL/SQL, VBA, python. "
Senior asp.net developer (Ведущий asp.net разработчик/ C#),https://vidnoe.hh.ru/vacancy/34085080?query=python,ООО Аналитические решения,"Разрабатывать продукт, которым ежедневно пользуются тысячи клиентов. Разрабатывать архитектурные решения, оптимизировать существующие алгоритмы и процессы. Возможность организовывать и участвовать в... Опыт разработки с использованием C#, ASP.NET MVC от 3 лет. Опыт работы с MSSQL или PostgreSQL от 2 лет. "
Разработчик Machine Learning (Attack Killer),https://vidnoe.hh.ru/vacancy/33912430?query=python, INFOWATCH,"Создание прототипов и рабочих моделей решений в средах программных продуктов С/С++, Python, R, Scala (на выбор). Разработка интерфейсов для... Умение интерпретировать качество полученных моделей. Языки программирования – С/С++, Python, R, Scala (на выбор, каждый по отдельности – преимущество) на уровне..."
