Название Вакансии,URL,Название компании,Описание
Senior Full stack (JS/Python/.NET) developer (Upverter),https://vidnoe.hh.ru/vacancy/33962947?query=python,ООО Представительство компании Altium Europe GMBH,"Сферы использования продуктов: производство электроники, автомобилей, роботов, решения в телеком-сфере. Upverter.com – электронное CAD-решение для браузера, позволяющее упростить проектирование... Высшее техническое образование. Готовность «залезать» в код на Python/C#/Node.JS. Стремление развиваться в создании сложных проектов на инженерную тематику. "
"Full- stack разработчик (Python,React)",https://vidnoe.hh.ru/vacancy/32170344?query=python, Инфосистемы Джет,Разрабатывать на Python и внедрять backend для внутренних корпоративных систем. Помочь выстроить процесс разработки согласно best-practice и поможет перевести... Опыт коммерческой разработки клиент-серверных приложений от 3 -х лет. Профессиональный уровень владения Python 3. Готовность делиться знаниями и навыками. 
Frontend-разработчик,https://vidnoe.hh.ru/vacancy/33931015?query=python,ООО KTS Studio,"Разработка и поддержка фронтенда портала и внутренних систем. Создание удобных интерфейсов для преподавателей и для студентов. Создание инструментов для аналитики... Отлично, если есть опыт работы с React и его экосистемой. Желательны базовые знания Python, Django. Будет плюсом знание Go, Docker..."
Full-stack разработчик,https://vidnoe.hh.ru/vacancy/33836102?query=python, Group-IB,Разработка новых и доработка существующих сервисов компании. Написание unit-тестов. Активное участие в проектировании сервисов комапнии. Анализ данных. Хорошее знание JS. Хорошее знание Python или Golang (либо желание изучить Golang). Понимание нюансов асинхронного кода. Понимание принципов ООП и...
Devops-инженер,https://vidnoe.hh.ru/vacancy/33419693?query=python, Group-IB,"...и развитие нескольких крупных политик деплоя/обновлений (Ansible+Python). Контейнеризация приложений в Docker, поддержка существующих образов. Решение сопутствующих задачек на Python. Практический навык программирования на Python. Опыт использования git, Gitlab. Английский язык для беглого чтения документации. Широкий технический кругозор. "
Data Engineer (Clickstream),https://vidnoe.hh.ru/vacancy/32925865?query=python,ООО Центр недвижимости от Сбербанка,Организация хранения миллиардов событий. Создание платформы для расчета множества метрик на основе этих событий. Создание высоконагруженной системы сбора метрик с... Имеющего опыт работы с колоночными и NoSQL базами данных. Плюсом будет:
Программист С++,https://vidnoe.hh.ru/vacancy/33708805?query=python,ООО Финстарлабс," Знание boost, cocos2d, bash, SQL, JSON, C#, Java, python. Умение работать в команде и читать чужой код, ответственность..."
Программист-разработчик Node.js (JavaScript) + Python,https://vidnoe.hh.ru/vacancy/34072852?query=python,ООО Телеком-Биржа,Работа с NoSQL решениями. Работа с внешними API включая сбор данных с оборудования. Визуализация данных. Работа с Docker (не k... Опыт работы с Node.JS от 3 лет. Опыт работы с Python от 3 лет. Опыт работы с Docker Compose. 
Инженер-программист,https://vidnoe.hh.ru/vacancy/33880655?query=python,ООО Софтлоджик Рус,"поддержка и доработка существующих проектов, а также участие в разработке новых. базовые знания Python 3. - базовые знания HTML-CSS верстки, Javascript. - опыт работы с ОС семейства Linux, знание Bash/Unix shell. - "
Программист С++,https://vidnoe.hh.ru/vacancy/33624446?query=python, Адалиск,Разработка CAD системы. Написание кода инфраструктурных классов. Создание новых и усовершенствование существующих алгоритмов для работы с 3D моделями.  ...аналитической геометрии и линейной алгебры). Знание английского языка на уровне необходимом для ведения переписки. Опыт использования Python. Опыт использования Linux.
Frontend-разработчик,https://vidnoe.hh.ru/vacancy/33674532?query=python,АО НейроТренд,"Разработка frontend-приложений с использованием Vue.js. Поддержка и улучшение существующего функционала. Опыт работы с модулями Vuex, Vue Router, Vuetify. Опыт работы с Python: Django, Django Rest Framework, Falcon. Опыт работы с..."
"Программист-разработчик автономного коптера/дрона (STM32, C/C++)",https://vidnoe.hh.ru/vacancy/33792287?query=python, Marvelmind Robotics,"Причесывание существующих и написание новых модулей, чтобы доделать микро-дроны для автономного полета внутри помещения на основе Marvelmind Precise (±2... Опыт написания софта для STM32. Обязательны примеры успешных предыдущих проектов - высылайте описание сделанного. Опыт с PixHawk. PX4, ArduPilot. "
Data Engineer,https://vidnoe.hh.ru/vacancy/33957914?query=python, RJ Games,"Проектирование и разработка процедур загрузки/выгрузки данных (ETL) в хранилище данных и аналитические системы. Проверка корректности данных, поступающих в хранилище.  Отличное знание SQL. Опыт написания скриптов на R/Python. Опыт проектирования баз данных, создание индексов, представлений etc. Опыт разработки в..."
QA Automation Engineer / Специалист по автоматизированному тестированию,https://vidnoe.hh.ru/vacancy/33699848?query=python,ООО Профцентр СПЕЦИАЛИСТ,"Разработка тест-кейсов для автоматизированных тестов. Настройка тестового окружения. Разработка фреймворка автоматизации. Разработка и отладка автоматизированных тестов, тестовых скриптов.  Практический опыт разработки автоматизированных тестов. Опыт написания скриптов cmd/bat, C#, Python, bash, JScript, Power Shell. Базовые знания ООП. "
Fullstack developer Django/Python (middle level),https://vidnoe.hh.ru/vacancy/34060887?query=python, Университет НТИ 20.35,"Работа с образовательными платформами. Написание надежных систем обработки и высоконагруженных приложений. Участие в разработке нового функционала и поддержка текущего.  Django, Python, HTML, JS. Mysql/postgres. Celery. REST. Git. Linux shell. Jira. Docker. Опыт удаленной работы!"
Ведущий аналитик (Data scientist),https://vidnoe.hh.ru/vacancy/31690680?query=python,ООО КЭШОФФ,"Исследование данных на предмет закономерностей. Анализ и контроль качества данных. Исследование математических алгоритмов обработки данных. Ручная и автоматическая выгрузка и... Владение каким-либо языком программирования: Python (приветствуется), C, C++, C#, Java или любой другой. Свободное владение основными алгоритмами работы с..."
C++ Developer,https://vidnoe.hh.ru/vacancy/33933682?query=python, RJ Games,Разработка новой мобильной игры на авторском движке. Создание новых фичей и механик. Поддержка и рефакторинг существующего кода. Разработка и поддержка... Навыки работы с Сmake. Умение писать аккуратный поддерживаемый код. Знание Python. Наличие портфолио в публичных репозиториях. Наличие завершенных проектов. 
Разработчик React (React-native) front-end,https://vidnoe.hh.ru/vacancy/33791514?query=python,АО ЛеКлик,"LeClick для посетителей ресторанов – это удобный и понятный сервис по поиску, подбору и онлайн бронированию ресторанов. Мы помогаем в считанные... HTML5, CSS3. Большим плюсом будет базовое PHP или Python для облегчения коммуникации в команде."
Multi-sensor Fusion Engineer,https://vidnoe.hh.ru/vacancy/33676171?query=python, HUAWEI,"1) Responsible for intelligent transportation and V2X multi-sensor (video, radar, etc.) preprocessing algorithms (data cleaning, trajectory tracking... 1) CS, robotics, mathematics,EE related majors. 4) Proficient in at least one programming language (C/C++/Python)."
Senior PHP developer,https://vidnoe.hh.ru/vacancy/33606282?query=python, retailCRM,"Разрабатывать сервисы под очень большую нагрузку. Проектировать и совершенствовать дизайн сервисов. Планировать работы, оценивать задачи. Писать тесты для своих решений.  Опыт программирования на одном из языков Go, PHP, Python, Javascript от 3 лет, знать сильные и слабые стороны языка и..."
Research Manager / Исследователь (количественные исследования),https://vidnoe.hh.ru/vacancy/34028095?query=python,ООО Авентика,"Участвовать в обсуждении деталей исследовательских проектов. Разрабатывать программы исследований и инструментарий. Осуществлять проверку и обработку данных. Анализировать полученные данные и... Владение методами статистического анализа: регрессионный, факторный, кластерный анализ, деревья решений. Уверенное владение PowerPoint, Excel, SPSS. Python и R как преимущество."
Data Engineer/Analyst,https://vidnoe.hh.ru/vacancy/33933619?query=python, RJ Games,"Проектирование и разработка процедур загрузки/выгрузки данных (ETL) в хранилище данных и аналитические системы. Проверка корректности данных, поступающих в хранилище.  Отличное знание SQL. Опыт написания скриптов на R/Python. Опыт проектирования баз данных, создание индексов, представлений etc. Опыт разработки в..."
Системный администратор Linux,https://vidnoe.hh.ru/vacancy/34029486?query=python, B2B-Center,"Участие в эксплуатации веб-платформы. Сопровождение и развитие IT- инфраструктуры компании. Оптимизация рабочих процессов. Документирование инфраструктуры и процессов. Опыт работы с системами Ansible, Docker. Хорошее владение Bash, Python. Опыт работы с операционными системами и технологиями Microsoft (Windows Server..."
"Ведущий разработчик Oracle, PostgreSQL",https://vidnoe.hh.ru/vacancy/32070618?query=python," СОКБ, НИИ","Разработка структуры БД. Разработка серверной части (пакеты, процедуры, триггеры и т.д.), оптимизация запросов. Понимание Git Flow. Знание Jenkins. Английский язык – технический. Опыт работы с Linux на уровне опытного пользователя приветствуется. Желательно знание Python."
Visual Localization Algorithm Engineer,https://vidnoe.hh.ru/vacancy/33676133?query=python, HUAWEI,"1) Responsible for camera calibration, visual localization and 3D reconstruction related algorithm. 2) Responsible for the research, design, develop... ...transportation/vision SLAM/trajectory tracking related projects are preferred. 4) Proficient in at least on programming language (C/C++/Python)."
Database administrator MySQL (Percona),https://vidnoe.hh.ru/vacancy/33674754?query=python, Petrosoft Inc.,"Поддержка production environment. Реинжениринг топологии к простому реплицируемому виду. Анализ нагрузки и выдвижение рекомендаций в продуктовые команды. Резервное копирование/ восстановление... Хорошее понимание Linux, включая возможность проверки производительности аппаратного обеспечения и индикаторов нагрузки. 2+ лет Python/Shell Scripting."
Тестировщик ПО,https://vidnoe.hh.ru/vacancy/33615214?query=python,ООО Образование Будущего,Тестирование разрабатываемых программных продуктов - ручное и автоматическое. Работа с проектной документацией. Взаимодействие с командой разработки. Знание языков Python и JavaScript. Навыки работы в Linux-системах. Знание физических законов на уровне первого-второго курса технического вуза. 
Бизнес-аналитик/Программист,https://vidnoe.hh.ru/vacancy/33794401?query=python,ООО Октан,"1. Описание бизнес-процессов в компании. 2. Поиск, настройка и доработка решений по автоматизации (возможно, разработка собственного ПО). 3.  Высшее образование, приветствуется ВМК МГУ, Мехмат МГУ, МФТИ. 2. Приветствуется знание SQL, PHP, Python. 3. Релевантный практический опыт работы не..."
Data scientist (специалист по анализу данных),https://vidnoe.hh.ru/vacancy/33993630?query=python, Condé Nast,"Взаимодействие с отделом разработки по доработке сервисов отдела анализа данных (на Python): Рекомендательный сервис. ARM – платформа. Сервис для сегментации контента... Хороший уровень знания любого из диалектов SQL. Опыт разработки на Python. Опыт настройки инфраструктуры, деплоя. Опыт разработки ETL процессов. "
Data Scientist / Специалист по машинному обучению,https://vidnoe.hh.ru/vacancy/33565964?query=python, Ситимобил,"Выявление паттернов поведения водителей. Разработка систем машинного зрения. Умное распределение машин по заказам. Разработка алгоритмов навигации и улучшения карт.  Опыт разаработки/анализа с использованием Python от 1года. Знание классических и state-of-the-art алгоритмов Machine Learning, хороший..."
Data Scientist (NLP),https://vidnoe.hh.ru/vacancy/33811532?query=python, Платформа ОФД,"Решение исследовательских и прикладных задач в рамках создания и развития продуктов компании с применением современных методов статистического анализа и машинного... Знание и опыт решения реальных бизнес-задач, используя методы машинного обучения и статистического анализа. Опыт применения Python для обработки и..."
Python backend разработчик,https://vidnoe.hh.ru/vacancy/30392442?query=python, AdCombo.com,"Решать технические и бизнес задачи при разработке новых и доработке существующих REST API приложений с использованием Flask, SQLAlchemy, Sanic и... Знание и опыт работы с Python, чем больше тем лучше. Анализировать чужой код и вдумчиво писать свой с учётом потенциальных..."
Младший бэк-энд разработчик (Python),https://vidnoe.hh.ru/vacancy/31240024?query=python, Институт прикладных экономических исследований РАНХиГС при Президенте Российской Федерации,"Сбором и анализом данных из разнообразных источников. Построением отраслевых и межотраслевых экономических моделей. Разработкой и сопровождением экономических информационных систем.  Языка программирования Python. Языка запросов SQL и принципов организации реляционных СУБД. Пакета Selenium. Основ JavaScript, DOM, HTML, XPath. "
Инженер-программист,https://vidnoe.hh.ru/vacancy/33947675?query=python,ООО ИНИТИ,"Разработка функциональных модулей высокопроизводительной системы параллельных вычислений реального времени (преимущественно под ОС Linux). Опыт программирования на любом из ООП языков (C++, python, perl, java и т.д.). Понимание структур данных (различные виды деревьев..."
QA Engineer/тестировщик ПО,https://vidnoe.hh.ru/vacancy/33887139?query=python,ОАО Межрегиональный ТранзитТелеком,"Ручное тестирование разрабатываемых комплексов. Оформление дефектов, работа с разработчиком в локализации дефектов. Написание сценариев автоматического тестирования. Агрегация и проверка информации... Умение составлять тест-кейсы. Знание программных продуктов: Postman, Jmeter, TestRail, Tsung. Плюсом будет знание язков программирования: PHP, Python."
GFN Software Engineer (Gaming),https://vidnoe.hh.ru/vacancy/33666983?query=python, NVIDIA,"Acquire initial game binaries from various sources, like game developers or distribution platforms. Optimizing game packages for a virtualized environment.  Experience with scripting languages (LUA, Python, Batch). Expertise at gaming PC hardware. Experience in basic debugging and tools (Process Monitor..."
Senior Vue.js Front-end Developer,https://vidnoe.hh.ru/vacancy/32342494?query=python, YCLIENTS LLC,"Разрабатывать почти с нуля обновлённый front-end на vue.js, планировать его архитектуру. Писать легко поддерживаемый и тестируемый код, а также... Отлично знает JavaScript (es.next), TypeScript. Имеет обширный опыт работы с Vue.js. Умеет качественно верстать по mobile-first. Понимает как отлаживать..."
Аналитик,https://vidnoe.hh.ru/vacancy/33943352?query=python, FunCorp,Совместная работа с командой проекта. Анализ финансовых и продуктовых показателей проекта. Ad-hoc аналитика. Построение отчетности для проекта (как в... Понимание основных способов монетизации IT проектов. Уверенное владение SQL. Владение Python на достаточном для аналитика уровне. Опыт работы от 2...
Data Scientist,https://vidnoe.hh.ru/vacancy/31756431?query=python," МАГНИТ, Розничная сеть","Разработка статистических моделей/алгоритмов и их реализация на R, Python. Оптимизация инструментов и подходов к решению задач. Курирование развития младших... Лояльность. Навыки работы с современными аналитическими пакетами на R/Python. Умение работать со стеком технологий BigData (Hadoop, Spark, Hive). "
Тестировщик программного обеспечения,https://vidnoe.hh.ru/vacancy/32644490?query=python,Нек. орг. Государственное бюджетное учреждение города Москвы Центр налоговых доходов,Тестирование функционала информационных систем. Разработка тест кейсов и чек-листов для нового функционала. Разработка методик тестирования. Поддержка и развитие процесса... Опыт работы с инструментами автоматизированного тестирования (Selenium). Опыт работы со скриптовыми языками - python. Оформление результатов тестирования. Написание тест-планов и...
Cистемный администратор Zabbix,https://vidnoe.hh.ru/vacancy/34109960?query=python,ООО ПРОГ МАСТЕР,Администрирование и развитие системы мониторинга Zabbix. Расширение функционала системы мониторинга путем интеграции со сторонними ПО и написание скриптов.  Понимание принципов работы системы мониторинга и опыт ее администрирования навыки написания скриптов (преимущественно Python и Bash). Опыт работы с оборудованием...
