Название Вакансии,URL,Название компании,Описание
QA auto engineer/Специалист по автоматизации тестирования,https://vidnoe.hh.ru/vacancy/30019058?query=python,ООО Ростелеком Информационные Технологии,"Написание автоматизированных тестов с помощью Python, pytest. Автоматизация задач обслуживания распределенного кластера и выявления/устранения неполадок (Linux). Автоматизация задач, связанных... Опыт работы с системами виртуализации и Docker. Знание bash. Знание python3. Опыт работы с крупномасштабными распределенными on-line системами. "
Head of Data Science,https://vidnoe.hh.ru/vacancy/33997029?query=python, PROFI.RU,Предсказание вероятности закрытия заказа. Оценка привлекательности заказа для специалистов. Классификация причин отказа клиента и специалиста. Предсказание стоимости заказа для специалистов... 
Team lead ML Platfrom/ Руководитель команды разработки платформы машинного обучения,https://vidnoe.hh.ru/vacancy/34068964?query=python, oneFactor,"Функциональное руководство командой разработки ядра платформы машинного обучения. Развитие toolset-a аналитиков и команды data science, а также исполнение модели... Понимание принципов работы JVM. Знание Python. Опыт работы со стеком Spark, Hadoop, Крайне желательно: Spark MLLib, Kafka, k8s. "
Системный инженер (DevOps),https://vidnoe.hh.ru/vacancy/33769375?query=python,ООО ПАРАМИТЕК,"Поддержка инфраструктуры отдела разработок. Обеспечение сборок версий ПО. Проведение консультаций заказчика с выездом на место установки разработческого ПО.  ...свои без применения сторонних языков программирования, таких как Perl и Python. (Advanced Bash Scripting). Умение настраивать системное ПО при помощи..."
Quantitative Researcher,https://vidnoe.hh.ru/vacancy/29951080?query=python," Агентство 21 век, КЦ","Критерии отбора: ...в области теории вероятностей, статистики, оптимизации, численных методов. Уверенное знание английского языка. Понимание количественных финансов, машинного обучения, экономики. Знание Python."
DevOps,https://vidnoe.hh.ru/vacancy/33787930?query=python, Diamond Personnel R&C,"Администрирование инструментов DevOps для обеспечения бесперебойного функционирования согласно уровню критичности. Подготовка эксплуатационных требований и документации по сопровождаемым ИТ-услугам.  Опыт администрирования Unix-систем (настройка, конфигурирования, резервное копирование). Опыт разработки скриптов (shell, python, ansible, Groovy) для автоматизации процессов администрирования Unix..."
Старший разработчик С++ (Linux),https://vidnoe.hh.ru/vacancy/33146636?query=python, INFOWATCH,"Разработка, отладка и оптимизация сложных компонентов программной системы. Составление технической документации. Обзоры кода других разработчиков, консультирование. Разработка Unit-тестов. Опыт работы в команде, умение быстро разбираться в чужом коде. Опыт программирования на Python, Go. Опыт рефакторинга больших компонентов. "
"Аналитик дирекции внутреннего аудита (IT/Big data, ст.м. Румянцево)",https://vidnoe.hh.ru/vacancy/34071807?query=python, Tele2,"Проведение и участие в консалтинговых проектах и проектах по аудиту бизнес-процессов и ИТ-зависимых бизнес-процессов. Анализ больших данных.  Опыт работы с инструментами анализа больших данных (например, SQL, Python, JS, Jupyter Notebook, PowerPivot, MS BI и др.). "
DevOps инженер,https://vidnoe.hh.ru/vacancy/34068257?query=python," Велес Капитал, ИК","Микросервисная архитектура. Основные сервисы на .NET Core, но есть Keycloak (Java) в качестве сервиса авторизации. Front на Angular.  ...с нуля (Jenkins). Опыт работы с Docker и Kubernetes. Опыт конфигурирования Nginx. Опыт настройки систем мониторинга. Уверенные знания Bash, Python."
Ведущий аналитик,https://vidnoe.hh.ru/vacancy/33691781?query=python, СофтТелематика,"Сбор, анализ и формализация требований. Разработка и описание бизнес-процессов (еEPC и BPMN 2). Проектирование экранных форм. Разработка проектной документации.  Глубокое понимание методологий разработки (Agile, Waterfall) и жизненного цикла ПО. Опыт работы с bug-трэкинговыми системами (Jira Agile, YouTrack и..."
Программист-стажер 1С,https://vidnoe.hh.ru/vacancy/31551931?query=python, Первый Бит,"Доработка программы под нужды заказчика. Консультация клиентов по вопросам работы программы 1С. Установка, настройка, обновление программы 1С. Знание любых языков программирования (не обязательно 1С). Высшее техническое или среднее специальное образование – законченное или студенты последнего курса. "
Системный администратор Linux,https://vidnoe.hh.ru/vacancy/33691778?query=python,ООО Инновационная мобильность,Обслуживание локальной сети в офисе компании. Настройка и обслуживание сетевого оборудования Cisco/Aruba/HPE/Dell/Unifi. Администрирование серверов с ОС... Опыт в администрировании и мониторинге Kubernetes/Docker инфраструктуры. Опыт написания скриптов: bash/perl/python. Знание системы мониторинга Zabbix. 
Старший инженер-тестировщик (автоматизированное функциональное тестирование),https://vidnoe.hh.ru/vacancy/27364976?query=python, Аплана Софтвер,Запуск автоматизированного функционального тестирования на Java. Разработка и актуализация автоматизированных тестов для толстых и тонких клиентов. Контроль работ по афт... Опыт работы в роли разработчика автотестов более 1 года (Java или С#). Опыт разработки фреймворка для автоматизированного тестирования. 
Frontend-разработчик,https://vidnoe.hh.ru/vacancy/32952530?query=python, OZON.travel," Знание Docker, Kubernetes. Опыт разработки на других языках Go / C# / C / C ++ / Java / PHP / Python / Ruby приветствуется."
Support Engineer (API Cloud Platform),https://vidnoe.hh.ru/vacancy/33445712?query=python, Acronis,"Actively work with partners and customers to answer API- and Platform-related technical questions via email, phone, Forum community, or... Ability to analyze technical issues and to convey technical information effectively. Programming experience in Python and/or PHP. "
ГИС аналитик,https://vidnoe.hh.ru/vacancy/33769314?query=python, РеИнформ Инт.,"Анализ пространственных данных (космическая съемка, цифровые модели рельефа), написание скриптов для анализа данных на языках программирования Python. Комплексный геопространственный анализ... Опыт участия в проектах по реализации информационных систем в качестве бизнес-аналитика ГИС. Хорошее владение MS Visio, Word. "
Technical writer,https://vidnoe.hh.ru/vacancy/33873648?query=python, Waves,"Бариста предложит и приготовит более 50 видов горячих напитков на выбор (кофе, чай, какао...). Опыт программирования на одном из языков: C#, Java, JavaScript, Python, C++. Опыт работы с git и Linux. Будет здорово, если..."
DevOps-инженер,https://vidnoe.hh.ru/vacancy/33552134?query=python,ООО Сбербанк-Телеком,"Сопровождение ПО высоконагруженных телекоммуникационных платформ. Обеспечение плановых задач администрирования. Взаимодействие с командами разработки и эксплуатации. Обеспечение внедрения релизов.  Знание сетевых технологий TCP/IP. Опыт программирования на скриптовых языках (shell, python, perl). Знание командных инструментов, git, jira или аналогичных. "
Скоринг-аналитик,https://vidnoe.hh.ru/vacancy/33975499?query=python,ООО Элемент Лизинг,"Построение моделей кредитного скоринга юридических лиц. Написание технической документации для построенных моделей. Тестирование качества действующих моделей. Владеете Python (Pandas, NumPy, Matplotlib, Sklearn), SQL. Знаете методы машинного обучения в области задачи бинарной классификации (как преимущество). "
Video/Image Compression Algorithm Expert,https://vidnoe.hh.ru/vacancy/33675203?query=python, HUAWEI,"1) Responsible for the planning of video & picture compression algorithms. Responsible for the deepdive, competitive analysis and project planning to... 5) Skilled in c/c++, python, Java etc. programming languages, skilled use of Tensorflow, Caffe, Keras, etc. AI programming framework. "
SOC / SIEM ИНЖЕНЕР ПО ИНФОРМАЦИОННОЙ БЕЗОПАСНОСТИ (МОСКВА),https://vidnoe.hh.ru/vacancy/33700446?query=python,АО Кросс технолоджис,"Участие в комплексных проектах Компании, работа непосредственно с заказчиками. Участие в предпродажной деятельности (Presale). Стендирование решений ИБ, внедрение средств защиты.  Опыт разработки на языках Java, SCALA, Python, знание технологий BigData. Знание технического английского языка на уровне чтения иностранной литературы (сдача..."
Junior RPA Developer / Младший RPA Разработчик,https://vidnoe.hh.ru/vacancy/33604268?query=python,ООО Новейшие Цифровые Технологии,"Работа в команде по разработке программных роботов для автоматизации бизнес-процессов. Разработка программных роботов RPA с использованием платформы Automation Anywhere... Знание и опыт разработки на С#, .Net, Python – как преимущество. Опыт участия в проектах автоматизации и/или интеграции, в том..."
Software Development Engineer in Test C#,https://vidnoe.hh.ru/vacancy/34073037?query=python, Лаборатория Касперского,"Улучшение существующих и создание новых автоматизированных тестов на С#. Анализ результатов автотестов и заведение дефектов. Разработка и поддержка вспомогательного ПО... Владение технологией WCF. Опыт работы с Git. Знание скриптовых языков: JavaScript, Python. Опыт написания SQL запросов, понимание принципов организации баз..."
Специалист (Мониторинг кредитных рисков),https://vidnoe.hh.ru/vacancy/34071959?query=python,АО ДОМ.РФ,"Участие в формировании запросов к базам данных. Участие в обработке данных (агрегация, верификация, анализ) по сделкам проектного финансирования из различных... Продвинутый уровень Excel (сводные таблицы, импорт данных), PowerPoint, знание VBA, SQL, Python. Навыки системного анализа, знание реляционных баз данных на..."
Разработчик (Административный департамент),https://vidnoe.hh.ru/vacancy/32597504?query=python, Банк ВТБ (ПАО),Участие в разработке пилотных проектов для обоснования востребованности продукта и эффективности. Проектирование архитектуры и разработка новых сервисов Административного департамента.  Понимание принципов работы различных архитектур нейронных сетей. Опыт программирования на Python/C++/C#/PHP. Опыт внедрения и улучшения бизнес-процессов. 
Разработчик T-SQL,https://vidnoe.hh.ru/vacancy/33236511?query=python, РУССКАРТ,"Проектирование структур данных. Разработка хранимых, процедур, функций, триггеров. Создание и оптимизация SQL-запросов и индексов. Взаимодействие с отделами разработки.  Знание одной из технологий web-разработки ASP. NET, PHP, Python, JSP. Умение читать и понимать планы запросов. Желание осваивать новые..."
Global ASO Manager,https://vidnoe.hh.ru/vacancy/34100059?query=python, Лаборатория Касперского,"ASO-аудит страниц приложений. Мониторинг стратегий конкурентов, настройку отчетности по аквизишну и ASO. Создание и поддержание семантического ядра и оптимизация... Высшее образование в области ИТ, маркетинга или лингвистики. 1 год работы на позиции ASO Manager/Стажер/Интернет-маркетолог в крупной..."
Младший инженер по внедрению и техподдержке телекоммуникационного биллинга (Зеленоград),https://vidnoe.hh.ru/vacancy/33973285?query=python, Латера,Общее описание: — поддерживать работу уже внедренного биллинга. — участвовать в решении сложных задач совместно с разработчиками. — общаться с клиентами: консультировать по... умение установить и настроить приложение в консоли Linux. — знание основ языка запросов SQL. Опыт работы с любой СУБД будет плюсом. — 
Senior GoLang Developer,https://vidnoe.hh.ru/vacancy/33736613?query=python,АО Технологическая Компания Центр,"Проектирование и разработка новых сервисов букмекерской платформы 888, API и разработка документации. Рутинные задачи в виде поддержки существующей кодовой базы... Умение выстраивать грамотную архитектуру приложения и писать тестируемый код. Опыт работы с Python2 или Python3. Опыт работы с..."
Backend разработчик (Middle\Senior),https://vidnoe.hh.ru/vacancy/30948143?query=python, Ситимобил,"Разработка и улучшение сервисов в Ситимобил. Хорошее знание и опыт использования как минимум одного из языков - С/С++, С#, Python, Go, Perl, PHP, Java, Ruby. "
DevOps (AWS) remote work,https://vidnoe.hh.ru/vacancy/33963124?query=python, VIAcode,Define a pipeline in AWS Data Pipeline between two S3 buckets in two different accounts. Do fast adhoc data... Amazon Data Pipeline. AWS Lambda. AWS Step Functions. 2+ years Python development experience. Solid virtualization experience with Hyper-V...
Java / Scala senior big data developer (Customer Relationship),https://vidnoe.hh.ru/vacancy/33882306?query=python, Леруа Мерлен. Центральный офис,"Собственная разработка и поддержка приложения в области интернет коммерции. Заниматься написанием юнит тестов. Следование API-based и Cloud-native подходу.  Очень пригодится знакомство со Scala. Опыт использования Spark, Hadoop, Flink, S3, Greenplum, Aerospike, Docker. Представление об основных алгоритмах машинного..."
"Руководитель направления клиентской аналитики, Маркетплейс",https://vidnoe.hh.ru/vacancy/32378950?query=python,ПАО Московская Биржа,"Изучение поведения клиентов платформы Маркетплейс: сегментация и кластеризация клиентской базы по поведенческим, социально-демографическим, продуктовым и др. характеристикам на основании... ...использования статистических пакетов (Python, R, SAS). Дополнительное образование в области построения DataLake на open-source решениях (Hadoop, Python, Kafka итд..."
Quantitative developer (HFT developer),https://vidnoe.hh.ru/vacancy/33207265?query=python, Cindicator,"Разработка программ, связанных с исследованиями рынка криптовалют: Разработка торговых стратегий (в соответствии с требованиями трейдеров). Создание инфраструктуры для трейдинга.  Объектно-ориентированное программирование. SQL. UNIX / Linux. Письменный и разговорный английский. Python (pandas, numpy, plotting). Понимание основ информатики, структур данных и..."
Инженер по тестированию сенсоров Беспилотных автомобилей,https://vidnoe.hh.ru/vacancy/33600523?query=python, Яндекс,Построение кроссплатформенной системы CI для кода на ARM и FPGA. Автоматизация тестирования сложного прибора: от софта и железа до интеграции... Понимание процессов ручного и автоматического тестирования. Опыт Hardware тестирования. Опыт написания кода на Python/C++ от 2 лет.
Разработчик BI (Vertica),https://vidnoe.hh.ru/vacancy/33234812?query=python, OZON.ru Разработка,"Разработка нового хранилища данных на основе СУБД Vertica. Участие в полном цикле построения BI-решений (проектирование, разработка, поддержка, развитие).  Опыт проектирования и разработки DWH. Знание СУБД Vertica обязательно. Знание платформы Apache AirFlow для запуска ETL. Знание языка Python для..."
Senior Golang Developer,https://vidnoe.hh.ru/vacancy/34069798?query=python, OZON.travel, Опыт разработки на Go / C# / C / C ++ / Java / PHP / Python / Ruby (любой из перечисленных языков). Умение работать быстро и...
JavaScript Developer,https://vidnoe.hh.ru/vacancy/33681445?query=python, Cloud Linux,"Formulate new and alternate ideas, approaches, and designs. Open to and values collaboration and feedback from others. More than 2 years experience with JavaScript professional development. Strong knowledge of JavaScript (ES6). Knowledge of HTML 5. "
Системный администратор Linux/DevOps,https://vidnoe.hh.ru/vacancy/33748370?query=python, BingoBoom,"Почтовые сервера (Postfix+Dovecot+ClamAV+Spamassasin+roundcube). Сети (Linux, mikrotik) Виртуализации (Proxmox). Веб-сервера (nginx) Корпоративный чат (Matrix + Riot). Мониторинг (zabbix).  Знание сетей (Routing, DNS, DHCP, Firewall, VPN, VLAN, STP, OSPF). Уметь программировать на скриптовых языках (python, bash). Опыт написания и..."
Программист PostgreSQL (PL/PGSQL),https://vidnoe.hh.ru/vacancy/32557339?query=python,ООО АБР Тех,"Разработка и сопровождение серверной части CRM системы, включая проектирование модели данных, создание объектов БД. Создание хранимых серверных процедур БД для... ...СУБД Oracle (знание PL/SQL). Опыт работы с git или другой системой контроля версий. Плюсом будет знание FastReport, JasperReports, Python."
DevOps Engineer (to Cyprus),https://vidnoe.hh.ru/vacancy/34069663?query=python,ООО Spotware Systems Ltd,"Automate Build/Deploy and software configuration/release management related tasks. Install, configure, administer, and tune application servers. Work with Development... Continuous Integration/Continuous Deployment (Jenkins). Good knowledge of Python scripting. Fluency in some of major scripting languages: shell scripts, groovy. "
Инженер систем виртуализации и СХД / Системный администратор,https://vidnoe.hh.ru/vacancy/33932487?query=python, NeoCommunications,"Администрирование систем хранения данных и SAN-сети. Администрирование системы виртуализации. Администрирование серверного оборудования с архитектурой x86. Мониторинг состояния и... Желателен опыт развертывания и сопровождения систем резервного копирования: Bareos, Veeam. Умение автоматизировать рутинные задачи, знание скриптовых языков (bash / python)."
